{
  "benchmark_id": "bria-bench",
  "benchmark_version": "0.1.0",
  "cases": [
    {
      "annotation_path": "annotations/regression/case_001.json",
      "annotation_sha256": "8a592b53ecbf2f704e42cf468fa3c2df47e28d97e2e1e09a846db0c4eea18235",
      "case_id": "case_001",
      "expected_sha256": "8217134197e52d1dc6c270382f9ce413e0abbadbdd52b9c2c087a41dd379ed58",
      "headline_eligible": false,
      "license": "MIT",
      "mode": "internal_presubmission",
      "notes": "These are repository-authored procedural synthetic fixtures copied byte-for-byte from the legacy eval collection; redistributable under the repository MIT license.",
      "package_path": "cases/regression/case_001",
      "redistributable": true,
      "scan_profile": "standard",
      "source": "evals/cases/case_001",
      "split": "reference",
      "track": "regression"
    },
    {
      "annotation_path": "annotations/regression/case_002.json",
      "annotation_sha256": "8a1dd4361f8a7103a2e813a6271827c3c36738e9d03850256074cc2f507febeb",
      "case_id": "case_002",
      "expected_sha256": "57bd63d0460251ef0c72f90e9f7b526d02da3639500c5bf942dd8d21c5da024f",
      "headline_eligible": false,
      "license": "MIT",
      "mode": "internal_presubmission",
      "notes": "These are repository-authored procedural synthetic fixtures copied byte-for-byte from the legacy eval collection; redistributable under the repository MIT license.",
      "package_path": "cases/regression/case_002",
      "redistributable": true,
      "scan_profile": "standard",
      "source": "evals/cases/case_002",
      "split": "reference",
      "track": "regression"
    },
    {
      "annotation_path": "annotations/regression/case_003.json",
      "annotation_sha256": "3a6838cdfb506bcd61eb8269d328bc114b81ccaec5904cfb8215c6f139a82c83",
      "case_id": "case_003",
      "expected_sha256": "0d740a9f028f362c5a5ab939895fec674125d456c0a19f4475e90a52759c54fe",
      "headline_eligible": false,
      "license": "MIT",
      "mode": "internal_presubmission",
      "notes": "These are repository-authored procedural synthetic fixtures copied byte-for-byte from the legacy eval collection; redistributable under the repository MIT license.",
      "package_path": "cases/regression/case_003",
      "redistributable": true,
      "scan_profile": "standard",
      "source": "evals/cases/case_003",
      "split": "reference",
      "track": "regression"
    },
    {
      "annotation_path": "annotations/regression/case_004.json",
      "annotation_sha256": "a93946366cf5e2092444fad9fc95366661534071b8846557c5ed411522f55c74",
      "case_id": "case_004",
      "expected_sha256": "76ac5afaca00ed530e70cc08ad3b59c949e4cce47dbd459f41e836b7539f6fcd",
      "headline_eligible": false,
      "license": "MIT",
      "mode": "internal_presubmission",
      "notes": "These are repository-authored procedural synthetic fixtures copied byte-for-byte from the legacy eval collection; redistributable under the repository MIT license.",
      "package_path": "cases/regression/case_004",
      "redistributable": true,
      "scan_profile": "standard",
      "source": "evals/cases/case_004",
      "split": "reference",
      "track": "regression"
    },
    {
      "annotation_path": "annotations/regression/case_005.json",
      "annotation_sha256": "727870e89de2d50ac073623277fc6d662a7fe6548eef89c0739668579a6a35de",
      "case_id": "case_005",
      "expected_sha256": "fb08b0966a976800fddb7741259eb0e355335512836c1a25f5c74815429afe20",
      "headline_eligible": false,
      "license": "MIT",
      "mode": "internal_presubmission",
      "notes": "These are repository-authored procedural synthetic fixtures copied byte-for-byte from the legacy eval collection; redistributable under the repository MIT license.",
      "package_path": "cases/regression/case_005",
      "redistributable": true,
      "scan_profile": "standard",
      "source": "evals/cases/case_005",
      "split": "reference",
      "track": "regression"
    },
    {
      "annotation_path": "annotations/regression/case_006.json",
      "annotation_sha256": "d1a61bc74dd68e5ec4eeb9ad9fdfe500de61216b437dd5020e203ccddddc0f5d",
      "case_id": "case_006",
      "expected_sha256": "4fa50e5312e9ebd55736aaa495416ec8b62797347e169cca1e1e418a387e503d",
      "headline_eligible": false,
      "license": "MIT",
      "mode": "internal_presubmission",
      "notes": "These are repository-authored procedural synthetic fixtures copied byte-for-byte from the legacy eval collection; redistributable under the repository MIT license.",
      "package_path": "cases/regression/case_006",
      "redistributable": true,
      "scan_profile": "standard",
      "source": "evals/cases/case_006",
      "split": "reference",
      "track": "regression"
    },
    {
      "annotation_path": "annotations/regression/case_007.json",
      "annotation_sha256": "a874093aba2e16c26ce6b1d5413b8766fc003c0f340e10fed7a40e594f63e094",
      "case_id": "case_007",
      "expected_sha256": "8afc8b33db361b8499fc6195a30b296f969ee9838e70f52d07e6c8671e96c8e2",
      "headline_eligible": false,
      "license": "MIT",
      "mode": "internal_presubmission",
      "notes": "These are repository-authored procedural synthetic fixtures copied byte-for-byte from the legacy eval collection; redistributable under the repository MIT license.",
      "package_path": "cases/regression/case_007",
      "redistributable": true,
      "scan_profile": "standard",
      "source": "evals/cases/case_007",
      "split": "reference",
      "track": "regression"
    },
    {
      "annotation_path": "annotations/regression/case_008.json",
      "annotation_sha256": "ebf28c93680dc796cc74fd7f7ac8b3f2d3e9ae6ebc76b246b2ae4408f0f382fb",
      "case_id": "case_008",
      "expected_sha256": "8be79012e04d79df9bc6cbee5e82b601b11189ae3dba483ebdbe60dbb8200068",
      "headline_eligible": false,
      "license": "MIT",
      "mode": "internal_presubmission",
      "notes": "These are repository-authored procedural synthetic fixtures copied byte-for-byte from the legacy eval collection; redistributable under the repository MIT license.",
      "package_path": "cases/regression/case_008",
      "redistributable": true,
      "scan_profile": "standard",
      "source": "evals/cases/case_008",
      "split": "reference",
      "track": "regression"
    },
    {
      "annotation_path": "annotations/regression/case_009.json",
      "annotation_sha256": "f604b066c305c03feff93054b84fc67188b304c8a1ab5cc2cb5756fdba60f4b7",
      "case_id": "case_009",
      "expected_sha256": "ddaf6f4e2ae37f36acd24cf042f91b0911772135d189b4d2eabca47296faea9e",
      "headline_eligible": false,
      "license": "MIT",
      "mode": "external_public_material",
      "notes": "These are repository-authored procedural synthetic fixtures copied byte-for-byte from the legacy eval collection; redistributable under the repository MIT license.",
      "package_path": "cases/regression/case_009",
      "redistributable": true,
      "scan_profile": "standard",
      "source": "evals/cases/case_009",
      "split": "reference",
      "track": "regression"
    },
    {
      "annotation_path": "annotations/regression/case_010.json",
      "annotation_sha256": "e15a2a03449bc2efe76a2af59f35598b96d2c062c0e19f345308b70f61c47a86",
      "case_id": "case_010",
      "expected_sha256": "a1c0a1560814201dd2dbe60366eb79129e92eaabe2c1730b1eda3095a0e0c5ba",
      "headline_eligible": false,
      "license": "MIT",
      "mode": "internal_presubmission",
      "notes": "These are repository-authored procedural synthetic fixtures copied byte-for-byte from the legacy eval collection; redistributable under the repository MIT license.",
      "package_path": "cases/regression/case_010",
      "redistributable": true,
      "scan_profile": "standard",
      "source": "evals/cases/case_010",
      "split": "reference",
      "track": "regression"
    },
    {
      "annotation_path": "annotations/regression/case_011.json",
      "annotation_sha256": "24ff11da56a19d49e012b1459591483a46329fbae7e3421c8da80e660fdcb1ca",
      "case_id": "case_011",
      "expected_sha256": "a584432b190dd3a77f0e8572a82706938c2eae5f969d76bfc224fa92f90fef34",
      "headline_eligible": false,
      "license": "MIT",
      "mode": "internal_presubmission",
      "notes": "These are repository-authored procedural synthetic fixtures copied byte-for-byte from the legacy eval collection; redistributable under the repository MIT license.",
      "package_path": "cases/regression/case_011",
      "redistributable": true,
      "scan_profile": "standard",
      "source": "evals/cases/case_011",
      "split": "reference",
      "track": "regression"
    },
    {
      "annotation_path": "annotations/regression/case_012.json",
      "annotation_sha256": "e500898e96ed32af0d54f1087b6f60e156c8dc2cd0810701c505c56746d0dd5e",
      "case_id": "case_012",
      "expected_sha256": "6da48646771f035302fa9d34812966fd5c0f43b31df248b1785f2fa662c81a95",
      "headline_eligible": false,
      "license": "MIT",
      "mode": "internal_presubmission",
      "notes": "These are repository-authored procedural synthetic fixtures copied byte-for-byte from the legacy eval collection; redistributable under the repository MIT license.",
      "package_path": "cases/regression/case_012",
      "redistributable": true,
      "scan_profile": "standard",
      "source": "evals/cases/case_012",
      "split": "reference",
      "track": "regression"
    },
    {
      "annotation_path": "annotations/regression/case_013.json",
      "annotation_sha256": "d4453f06eaf16f78735e446e39e5c34634611b533ab44e23b0e9f8a025201e1e",
      "case_id": "case_013",
      "expected_sha256": "10b8ad9fc07d8c0bb7dce2b967453aa67ef2e45f8ac54925317a2ad2b45d316e",
      "headline_eligible": false,
      "license": "MIT",
      "mode": "internal_presubmission",